{
  "note": "The edition lineage of the failure taxonomy: what each version added, and the artifact each delta was measured from. The registry (monitor/failure-taxonomy.json) states the CURRENT edition and nothing about how it got there; the prose editions each describe their own delta and disagree with each other about the totals. This file is the reconciliation, and bin/taxonomy-web.mjs refuses to render a page whose editions do not account for exactly the classes the registry holds.",
  "verifiedAgainst": "2026-08-23",
  "measurement": "Class ids per edition are derived from definition tables, never from prose counts: v1 from its family II-VII tables, v2 from its three shade tables (sections 4-6), v3 from section 10.2, the false-clean classes from the catalogue's own class table at the naming commit. v4, v5 and v6 are measured from their rendered artifacts under reports/, which are gitignored: the sha256 below is the only durable witness, and it dies with the file.",
  "witnesses": [
    {
      "path": "reports/FAILURE-TAXONOMY-v4.html",
      "tracked": false,
      "sha256": "be67f6d05da7dd1e4bb1f2036ca757bbe55bd14de5a8a8d17e868b2db8009592",
      "producedAt": "2026-08-12 22:58",
      "classes": 96
    },
    {
      "path": "reports/FAILURE-TAXONOMY-v5.html",
      "tracked": false,
      "sha256": "70a645b8be81af14e3aecdb5bc287d783250da696b98f2e3a01d613e4733acf2",
      "producedAt": "2026-08-12 23:16",
      "classes": 96
    },
    {
      "path": "reports/FAILURE-TAXONOMY-v6.html",
      "tracked": false,
      "sha256": "b6ba6f23d3dd7aff053e364881337eff31604b009626c14fd65f2b641518e92a",
      "producedAt": "2026-08-14 11:09",
      "classes": 97
    }
  ],
  "editions": [
    {
      "version": 0,
      "label": "The false-clean catalogue",
      "date": "2026-08-10",
      "form": "prose, per-incident record",
      "artifact": "monitor/FALSE-CLEAN-TAXONOMY.md",
      "tracked": true,
      "headline": "One family, catalogued per incident, before there was a taxonomy to put it in.",
      "body": "A false clean is any mechanism by which the absence of an alarm is mistaken for the presence of health. The instances were scattered across agent instructions, code comments, handoffs and archived remediations; this edition consolidates them into one durable record with a row per incident and a citation into the tree. It is a living document: new incidents get a row, not a rewrite, which is why it still grows five editions later.",
      "changes": [
        {
          "kind": "classes",
          "date": "2026-08-10",
          "ids": [
            "C1",
            "C2",
            "C3",
            "C4",
            "C5",
            "C6",
            "C7",
            "C8",
            "C9",
            "C10"
          ],
          "note": "The family opens with ten classes and their incidents."
        },
        {
          "kind": "classes",
          "date": "2026-08-11",
          "ids": [
            "C11",
            "C12"
          ],
          "note": "Two rows the session earned: the accusing ratchet and the laundered floor."
        },
        {
          "kind": "axis",
          "label": "class to incident",
          "note": "Every class carries the occurrences observed against it, each citing a sha or a path, so a class is never only an argument."
        },
        {
          "kind": "section",
          "label": "What closes each class",
          "note": "Per class, the mechanism that would end it — the first place in this project where closure is written down as a state rather than implied by a fix."
        }
      ],
      "countAfter": 12,
      "countWitness": {
        "basis": "doc-cited",
        "source": "monitor/FAILURE-TAXONOMY.md",
        "claim": "v1 hands family I back to this document as C1-C12"
      }
    },
    {
      "version": 1,
      "label": "The master classification",
      "date": "2026-08-12",
      "form": "prose, master document",
      "artifact": "monitor/FAILURE-TAXONOMY.md",
      "tracked": true,
      "headline": "A miss is one failure mode among many. Seven more families are hits that failed anyway.",
      "body": "The organising question arrives here and does not change again: which proposition did the oversight system believe that was false? Mechanism is the class level, the believed-false proposition is the family level, and it is the only axis on which the families do not overlap. Six new families follow — an alarm that is right about the defect and wrong about the scope, the cause, the owner, the repair, or the number attached to it. None of them show up as misses, which is why a catalogue organised around misses could not hold them.",
      "changes": [
        {
          "kind": "classes",
          "date": "2026-08-12",
          "ids": [
            "A1",
            "A2",
            "A3",
            "A4",
            "A5",
            "A6",
            "A7",
            "A8",
            "A9",
            "A10",
            "A11",
            "R1",
            "R2",
            "R3",
            "R4",
            "R5",
            "R6",
            "R7",
            "R8",
            "P1",
            "P2",
            "P3",
            "P4",
            "P5",
            "P6",
            "P7",
            "P8",
            "P9",
            "M1",
            "M2",
            "M3",
            "M4",
            "M5",
            "M6",
            "G1",
            "G2",
            "G3",
            "G4",
            "G5",
            "G6",
            "G7",
            "G8",
            "G9",
            "G10",
            "G11",
            "G12",
            "D1",
            "D2",
            "D3",
            "D4",
            "D5"
          ],
          "note": "Families II to VII, named here for the first time."
        },
        {
          "kind": "family",
          "label": "II False alarm content, III False repair, IV False provenance, V False measurement, VI Model-generated defect, VII False durability"
        },
        {
          "kind": "axis",
          "label": "warrant",
          "note": "Four grades, not equivalent: tree-verified, ledger-measured, doc-cited, transcript. The entries most likely to be disputed are named as such rather than levelled up."
        },
        {
          "kind": "section",
          "label": "Measured state",
          "note": "Adjudicated gate rates from the verdict journal, re-measured on 2026-08-13 — at which point every figure in the first published table proved wrong, all of them in the direction of less confidence."
        }
      ],
      "countAfter": 63,
      "countWitness": {
        "basis": "doc-cited",
        "source": "monitor/FAILURE-TAXONOMY-v2.md",
        "claim": "63 classes in total; 51 outside Family I"
      }
    },
    {
      "version": 2,
      "label": "The layer split and the shaded remainder",
      "date": "2026-08-12",
      "form": "prose, additive edition",
      "artifact": "monitor/FAILURE-TAXONOMY-v2.md",
      "tracked": true,
      "headline": "Every class is tagged with the layer that failed, and the palest evidence is shown first.",
      "body": "Two axes and twenty-six classes. The layer axis separates the code that produced the wrong artifact from the policy, ordering or authority that decided what ran — a distinction that matters because a controller failure is never fixed by editing the code that failed. Shading grades the warrant behind each class and sorts the least-evidenced to the front, on the argument that a derived class with no observed instance is the row most likely to be dismissed and therefore the row that has to lead. v2 does not re-author v1: re-typing the incident record into a new file would be D4, the class v1 measured at sixfold content loss.",
      "changes": [
        {
          "kind": "classes",
          "date": "2026-08-12",
          "ids": [
            "A12",
            "A13",
            "R9",
            "R10",
            "P10",
            "P11",
            "P12",
            "M7",
            "M8",
            "M9",
            "G13",
            "G14",
            "D6",
            "K1",
            "K2",
            "K3",
            "K4",
            "K5",
            "K6",
            "K7",
            "K8",
            "E1",
            "E2",
            "E3",
            "E4",
            "E5"
          ],
          "note": "Nine derived with no instance observed, eight with partial evidence, nine verified on the pass."
        },
        {
          "kind": "axis",
          "label": "layer",
          "note": "CTRL decides what runs, on what, in what order and what the result means; IMPL does the work; BOTH is both."
        },
        {
          "kind": "axis",
          "label": "shading",
          "note": "A warrant grade per class, with shade 3 (derived, no instance) shown before shade 1 (verified this pass)."
        },
        {
          "kind": "section",
          "label": "Bucket index",
          "note": "The four questions the pass was asked, answered by id, so the answer is checkable against the tables above it."
        }
      ],
      "countAfter": 89,
      "countWitness": {
        "basis": "doc-cited",
        "source": "monitor/FAILURE-TAXONOMY-v2.md",
        "claim": "51 to 77 classes outside Family I; 63 to 89 including it"
      }
    },
    {
      "version": 3,
      "label": "False progress",
      "date": "2026-08-12",
      "form": "prose, additive edition",
      "artifact": "monitor/FAILURE-TAXONOMY-v3.md",
      "tracked": true,
      "headline": "The family that covers doing nothing well.",